### ISSUE TITLE
DHCP behaviour needs investigating in various error scenarios 

### ISSUE THREAD

**Issue by mich181189** [londonhackspace/acnode-cl#61]
There is some evidence that if the DHCP server fails for an extended period of time, when it comes back up, nodes will not attempt to reconnect unless other timeouts cause them to (mostly accidentally) hit the watchdog timer.

**Comment by zymurgic** [comment]
finding: Energia network stack will configure up a link local address if DHCP fails. Doesn't mean that DNS lookups or routing will work. Any check for a valid IP address will need not assume a non-null IP address. There's a hard-coded DNS address if nothing else is set that uses 208.67.222.222.

**Comment by mich181189** [comment]
> 00:10:32.696157 ARP, Ethernet (len 6), IPv4 (len 4), Request who-has resolver1.opendns.com tell 169.254.113.69, length 46
00:10:33.653575 ARP, Ethernet (len 6), IPv4 (len 4), Request who-has resolver1.opendns.com tell 169.254.113.69, length 46
00:10:34.653629 ARP, Ethernet (len 6), IPv4 (len 4), Request who-has resolver1.opendns.com tell 169.254.113.69, length 46
00:10:36.653634 ARP, Ethernet (len 6), IPv4 (len 4), Request who-has resolver1.opendns.com tell 169.254.113.69, length 46
00:10:39.654817 ARP, Ethernet (len 6), IPv4 (len 4), Request who-has 0.0.4.32 tell 169.254.113.69, length 46
00:10:42.403717 ARP, Ethernet (len 6), IPv4 (len 4), Request who-has 0.0.4.32 tell 169.254.113.69, length 46
00:10:45.403768 ARP, Ethernet (len 6), IPv4 (len 4), Request who-has 0.0.4.32 tell 169.254.113.69, length 46
00:10:48.403805 ARP, Ethernet (len 6), IPv4 (len 4), Request who-has 0.0.4.32 tell 169.254.113.69, length 46

After DHCP fails, it tries anyway really really hard!

**Comment by mich181189** [comment]
When DHCP becomes unavailable, after the lease expires, it ends up in a similar situation to the above. Existing cache works (as in, it hasn't rebooted itself) but new cards don't get recognised properly.

When DHCP service is restored, it seems to pick up an address quite quickly, and begins working again without further prompts

**Comment by mich181189** [comment]
Logs from that to give an indication of what happens:

> 21:49:15.483420 IP 172.19.0.25.bootpc > ijiraq.bootps: BOOTP/DHCP, Request from 00:1a:b6:03:45:70 (oui Unknown), length 308
21:49:15.484002 IP ijiraq > 172.19.0.25: ICMP ijiraq udp port bootps unreachable, length 344
21:49:16.983442 IP 172.19.0.25.bootpc > ijiraq.bootps: BOOTP/DHCP, Request from 00:1a:b6:03:45:70 (oui Unknown), length 308
21:49:16.983852 IP ijiraq > 172.19.0.25: ICMP ijiraq udp port bootps unreachable, length 344
21:49:20.631279 ARP, Request who-has 172.19.0.25 tell ijiraq, length 28
21:49:20.631488 ARP, Reply 172.19.0.25 is-at 00:1a:b6:03:45:70 (oui Unknown), length 50
21:49:20.983518 IP 172.19.0.25.bootpc > ijiraq.bootps: BOOTP/DHCP, Request from 00:1a:b6:03:45:70 (oui Unknown), length 308
21:49:20.983979 IP ijiraq > 172.19.0.25: ICMP ijiraq udp port bootps unreachable, length 344
21:49:26.983618 IP 172.19.0.25.bootpc > ijiraq.bootps: BOOTP/DHCP, Request from 00:1a:b6:03:45:70 (oui Unknown), length 308
21:49:26.984065 IP ijiraq > 172.19.0.25: ICMP ijiraq udp port bootps unreachable, length 344
21:49:34.983758 IP 172.19.0.25.bootpc > ijiraq.bootps: BOOTP/DHCP, Request from 00:1a:b6:03:45:70 (oui Unknown), length 308
21:49:34.984266 IP ijiraq > 172.19.0.25: ICMP ijiraq udp port bootps unreachable, length 344
21:49:44.983940 IP 172.19.0.25.bootpc > ijiraq.bootps: BOOTP/DHCP, Request from 00:1a:b6:03:45:70 (oui Unknown), length 308
21:49:44.984399 IP ijiraq > 172.19.0.25: ICMP ijiraq udp port bootps unreachable, length 344
21:49:56.984130 IP 172.19.0.25.bootpc > ijiraq.bootps: BOOTP/DHCP, Request from 00:1a:b6:03:45:70 (oui Unknown), length 308
21:49:56.984585 IP ijiraq > 172.19.0.25: ICMP ijiraq udp port bootps unreachable, length 344
21:50:10.984379 IP 172.19.0.25.bootpc > ijiraq.bootps: BOOTP/DHCP, Request from 00:1a:b6:03:45:70 (oui Unknown), length 308
21:50:10.984864 IP ijiraq > 172.19.0.25: ICMP ijiraq udp port bootps unreachable, length 344
21:50:15.484452 IP 172.19.0.25.bootpc > 255.255.255.255.bootps: BOOTP/DHCP, Request from 00:1a:b6:03:45:70 (oui Unknown), length 308
21:50:15.984461 IP 172.19.0.25.bootpc > 255.255.255.255.bootps: BOOTP/DHCP, Request from 00:1a:b6:03:45:70 (oui Unknown), length 308
21:50:16.183244 ARP, Request who-has 172.19.0.25 tell ijiraq, length 28
21:50:16.183441 ARP, Reply 172.19.0.25 is-at 00:1a:b6:03:45:70 (oui Unknown), length 50
21:50:17.984497 IP 172.19.0.25.bootpc > 255.255.255.255.bootps: BOOTP/DHCP, Request from 00:1a:b6:03:45:70 (oui Unknown), length 308
21:50:20.984544 IP 172.19.0.25.bootpc > 255.255.255.255.bootps: BOOTP/DHCP, Request from 00:1a:b6:03:45:70 (oui Unknown), length 308
21:50:24.984617 IP 172.19.0.25.bootpc > 255.255.255.255.bootps: BOOTP/DHCP, Request from 00:1a:b6:03:45:70 (oui Unknown), length 308
21:50:29.984703 IP 172.19.0.25.bootpc > 255.255.255.255.bootps: BOOTP/DHCP, Request from 00:1a:b6:03:45:70 (oui Unknown), length 308
21:50:35.984814 IP 172.19.0.25.bootpc > 255.255.255.255.bootps: BOOTP/DHCP, Request from 00:1a:b6:03:45:70 (oui Unknown), length 308
21:50:42.984935 IP 172.19.0.25.bootpc > 255.255.255.255.bootps: BOOTP/DHCP, Request from 00:1a:b6:03:45:70 (oui Unknown), length 308
21:50:50.985075 IP 172.19.0.25.bootpc > 255.255.255.255.bootps: BOOTP/DHCP, Request from 00:1a:b6:03:45:70 (oui Unknown), length 308
21:50:59.985236 IP 172.19.0.25.bootpc > 0.0.0.0.bootps: BOOTP/DHCP, Request from 00:1a:b6:03:45:70 (oui Unknown), length 308
21:50:59.985497 IP 0.0.0.0.bootpc > 255.255.255.255.bootps: BOOTP/DHCP, Request from 00:1a:b6:03:45:70 (oui Unknown), length 308
21:51:01.985268 IP 0.0.0.0.bootpc > 255.255.255.255.bootps: BOOTP/DHCP, Request from 00:1a:b6:03:45:70 (oui Unknown), length 308
21:51:05.985338 IP 0.0.0.0.bootpc > 255.255.255.255.bootps: BOOTP/DHCP, Request from 00:1a:b6:03:45:70 (oui Unknown), length 308
21:51:13.985463 IP 0.0.0.0.bootpc > 255.255.255.255.bootps: BOOTP/DHCP, Request from 00:1a:b6:03:45:70 (oui Unknown), length 308
21:51:29.985745 IP 0.0.0.0.bootpc > 255.255.255.255.bootps: BOOTP/DHCP, Request from 00:1a:b6:03:45:70 (oui Unknown), length 308
21:51:30.185671 ARP, Request who-has 169.254.113.69 tell 0.0.0.0, length 46
21:51:31.385718 ARP, Request who-has 169.254.113.69 tell 0.0.0.0, length 46
21:51:32.585740 ARP, Request who-has 169.254.113.69 tell 0.0.0.0, length 46
21:51:35.885791 ARP, Request who-has 169.254.113.69 tell 169.254.113.69, length 46

**Comment by mich181189** [comment]
Closing as behaviour now more understood
